title,author,publicationName,cover_date,scopus_id,cited_by_count,open_access,eid,aggregationType,affiliations,link,abstract
Uncertainty and three-way decision in data science,Yao J.T.,International Journal of Approximate Reasoning,2023-11-01,SCOPUS_ID:85171379722,4,False,2-s2.0-85171379722,Journal,"[{'name': 'University of Regina', 'city': 'Regina', 'country': 'Canada'}]",https://www.scopus.com/inward/record.uri?partnerID=HzOxMe3b&scp=85171379722&origin=inward,Failed to fetch page (status 429)
The African Society of Human Genetics successfully launches global data science workshops,Nembaware V.,Trends in Genetics,2023-11-01,SCOPUS_ID:85171359254,0,True,2-s2.0-85171359254,Journal,"[{'name': 'Faculty of Health Sciences, University of Cape Town', 'city': 'Cape Town', 'country': 'South Africa'}]",https://www.scopus.com/inward/record.uri?partnerID=HzOxMe3b&scp=85171359254&origin=inward,Failed to fetch page (status 429)
What is uncertainty in today's practice of data science?,Yu B.,Journal of Econometrics,2023-11-01,SCOPUS_ID:85170287082,0,False,2-s2.0-85170287082,Journal,"[{'name': 'University of California, Berkeley', 'city': 'Berkeley', 'country': 'United States'}]",https://www.scopus.com/inward/record.uri?partnerID=HzOxMe3b&scp=85170287082&origin=inward,Failed to fetch page (status 429)
Mind the gender gap: Inequalities in the emergent professions of artificial intelligence (AI) and data science,Young E.,"New Technology, Work and Employment",2023-11-01,SCOPUS_ID:85168912982,13,True,2-s2.0-85168912982,Journal,"[{'name': 'The Alan Turing Institute', 'city': 'London', 'country': 'United Kingdom'}]",https://www.scopus.com/inward/record.uri?partnerID=HzOxMe3b&scp=85168912982&origin=inward,Failed to fetch page (status 429)
Leveraging Data Science to Advance Implementation Science: The Case of School Mental Health,Carlson C.,Journal of School Health,2023-11-01,SCOPUS_ID:85168101560,0,False,2-s2.0-85168101560,Journal,"[{'name': 'School of Social Work', 'city': 'Tuscaloosa', 'country': 'United States'}]",https://www.scopus.com/inward/record.uri?partnerID=HzOxMe3b&scp=85168101560&origin=inward,Failed to fetch page (status 429)
Developmental data science: How machine learning can advance theory formation in Developmental Psychology,Van Lissa C.J.,Infant and Child Development,2023-11-01,SCOPUS_ID:85139529880,11,True,2-s2.0-85139529880,Journal,"[{'name': 'Tilburg University', 'city': 'Tilburg', 'country': 'Netherlands'}]",https://www.scopus.com/inward/record.uri?partnerID=HzOxMe3b&scp=85139529880&origin=inward,Failed to fetch page (status 429)
Analysis and Identification of Evil Twin Attack through Data Science Techniques Using AWID3 Dataset,Da Silva L.M.,ACM International Conference Proceeding Series,2023-10-27,SCOPUS_ID:85183463155,2,False,2-s2.0-85183463155,Conference Proceeding,"[{'name': 'Universidade de São Paulo', 'city': 'Sao Paulo', 'country': 'Brazil'}]",https://www.scopus.com/inward/record.uri?partnerID=HzOxMe3b&scp=85183463155&origin=inward,Failed to fetch page (status 429)
A platform to help in generating code for machine learning and data science projects,Rajiv C.S.,AIP Conference Proceedings,2023-10-27,SCOPUS_ID:85179157980,0,False,2-s2.0-85179157980,Conference Proceeding,"[{'name': 'Vellore Institute of Technology, Chennai', 'city': 'Chennai', 'country': 'India'}]",https://www.scopus.com/inward/record.uri?partnerID=HzOxMe3b&scp=85179157980&origin=inward,Failed to fetch page (status 429)
Notably Inaccessible - Data Driven Understanding of Data Science Notebook (In)Accessibility,Potluri V.,ASSETS 2023 - Proceedings of the 25th International ACM SIGACCESS Conference on Computers and Accessibility,2023-10-22,SCOPUS_ID:85169026526,1,True,2-s2.0-85169026526,Conference Proceeding,"[{'name': 'UW College of Engineering', 'city': 'Seattle', 'country': 'United States'}]",https://www.scopus.com/inward/record.uri?partnerID=HzOxMe3b&scp=85169026526&origin=inward,Failed to fetch page (status 429)
Selecting Top-k Data Science Models by Example Dataset,Wang M.,"International Conference on Information and Knowledge Management, Proceedings",2023-10-21,SCOPUS_ID:85178103392,2,False,2-s2.0-85178103392,Conference Proceeding,"[{'name': 'Case Western Reserve University', 'city': 'Cleveland', 'country': 'United States'}]",https://www.scopus.com/inward/record.uri?partnerID=HzOxMe3b&scp=85178103392&origin=inward,Failed to fetch page (status 429)
"Investigate the Use of Artificial Intelligence, Data Science and Technology in Verdict and Treatment of COVID-19",Kaur G.,AIP Conference Proceedings,2023-10-20,SCOPUS_ID:85177552669,0,False,2-s2.0-85177552669,Conference Proceeding,"[{'name': 'Chandigarh University', 'city': 'Mohali', 'country': 'India'}]",https://www.scopus.com/inward/record.uri?partnerID=HzOxMe3b&scp=85177552669&origin=inward,Failed to fetch page (status 429)
Unlocking New Insights for Electrocatalyst Design: A Unique Data Science Workflow Leveraging Internet-Sourced Big Data,Ding R.,ACS Catalysis,2023-10-20,SCOPUS_ID:85174799227,8,False,2-s2.0-85174799227,Journal,"[{'name': 'Nanjing University', 'city': 'Nanjing', 'country': 'China'}, {'name': 'North China Electric Power University', 'city': 'Beijing', 'country': 'China'}]",https://www.scopus.com/inward/record.uri?partnerID=HzOxMe3b&scp=85174799227&origin=inward,Failed to fetch page (status 429)
Framework to infuse data science in the archives and records management curriculum in South Africa,Mojapelo M.,African Journal of Library Archives and Information Science,2023-10-16,SCOPUS_ID:85175558774,1,False,2-s2.0-85175558774,Journal,"[{'name': 'University of South Africa', 'city': 'Pretoria', 'country': 'South Africa'}]",https://www.scopus.com/inward/record.uri?partnerID=HzOxMe3b&scp=85175558774&origin=inward,Failed to fetch page (status 429)
NBGuru: Generating Explorable Data Science Flowcharts to Facilitate Asynchronous Communication in Interdisciplinary Data Science Teams,Keelawat P.,"Proceedings of the ACM Conference on Computer Supported Cooperative Work, CSCW",2023-10-14,SCOPUS_ID:85176271162,0,True,2-s2.0-85176271162,Conference Proceeding,"[{'name': 'University of California, San Diego', 'city': 'La Jolla', 'country': 'United States'}]",https://www.scopus.com/inward/record.uri?partnerID=HzOxMe3b&scp=85176271162&origin=inward,Failed to fetch page (status 429)
A Critical Review of Data Science Applications in Resource Recovery and Carbon Capture from Organic Waste,Zaki M.T.,ACS ES and T Engineering,2023-10-13,SCOPUS_ID:85174904621,9,True,2-s2.0-85174904621,Journal,"[{'name': 'West Virginia University', 'city': 'Morgantown', 'country': 'United States'}]",https://www.scopus.com/inward/record.uri?partnerID=HzOxMe3b&scp=85174904621&origin=inward,Failed to fetch page (status 429)
ChatGPT for Teaching and Learning: An Experience from Data Science Education,Zheng Y.,SIGITE 2023 - Proceedings of the 24th Annual Conference on Information Technology Education,2023-10-11,SCOPUS_ID:85176215123,12,True,2-s2.0-85176215123,Conference Proceeding,"[{'name': 'College of Computing', 'city': 'Chicago', 'country': 'United States'}]",https://www.scopus.com/inward/record.uri?partnerID=HzOxMe3b&scp=85176215123&origin=inward,Failed to fetch page (status 429)
Embedding Digital Data Storytelling in Introductory Data Science Course: An Inter-Institutional Transdisciplinary Pilot Study,Chen L.K.,Journal of Problem Based Learning in Higher Education,2023-10-10,SCOPUS_ID:85174483626,0,True,2-s2.0-85174483626,Journal,"[{'name': 'University of Maryland, Baltimore County (UMBC)', 'city': 'Baltimore', 'country': 'United States'}]",https://www.scopus.com/inward/record.uri?partnerID=HzOxMe3b&scp=85174483626&origin=inward,Failed to fetch page (status 429)
Data science in insurance,Singh Kaswan K.,The Application of Emerging Technology and Blockchain in the Insurance Industry,2023-10-08,SCOPUS_ID:85175664402,0,False,2-s2.0-85175664402,Book,"[{'name': 'Galgotias University', 'city': 'Greater Noida', 'country': 'India'}]",https://www.scopus.com/inward/record.uri?partnerID=HzOxMe3b&scp=85175664402&origin=inward,Failed to fetch page (status 429)
Prediction of Liver Disease Using Soft Computing and Data Science Approaches,Choubey D.K.,6G Enabled Fog Computing in IoT: Applications and Opportunities,2023-10-01,SCOPUS_ID:85190310656,3,False,2-s2.0-85190310656,Book,"[{'name': 'Indian Institute of Information Technology Bhagalpur', 'city': 'Bhagalpur', 'country': 'India'}]",https://www.scopus.com/inward/record.uri?partnerID=HzOxMe3b&scp=85190310656&origin=inward,Failed to fetch page (status 429)
Bridging the gap: Leveraging Power BI to connect data science and soccer coaches,Plakias S.,Journal of Physical Education and Sport,2023-10-01,SCOPUS_ID:85177460122,4,True,2-s2.0-85177460122,Journal,"[{'name': 'University of Thessaly', 'city': 'Volos', 'country': 'Greece'}]",https://www.scopus.com/inward/record.uri?partnerID=HzOxMe3b&scp=85177460122&origin=inward,Failed to fetch page (status 429)
Series Editorial: Artificial Intelligence and Data Science for Communications,Choi Y.,IEEE Communications Magazine,2023-10-01,SCOPUS_ID:85176118755,0,True,2-s2.0-85176118755,Journal,"[{'name': 'Seoul National University', 'city': 'Seoul', 'country': 'South Korea'}]",https://www.scopus.com/inward/record.uri?partnerID=HzOxMe3b&scp=85176118755&origin=inward,Failed to fetch page (status 429)
The Impact of Data Science Solutions on the Company Turnover,Cristescu M.P.,Information (Switzerland),2023-10-01,SCOPUS_ID:85175088951,5,True,2-s2.0-85175088951,Journal,"[{'name': 'Universitatea Lucian Blaga din Sibiu', 'city': 'Sibiu', 'country': 'Romania'}]",https://www.scopus.com/inward/record.uri?partnerID=HzOxMe3b&scp=85175088951&origin=inward,Failed to fetch page (status 429)
The Association between Childhood Obesity and Cardiovascular Changes in 10 Years Using Special Data Science Analysis,Cordeiro J.R.,Children,2023-10-01,SCOPUS_ID:85175083893,0,True,2-s2.0-85175083893,Journal,"[{'name': 'Iscte – Instituto Universitário de Lisboa', 'city': 'Lisbon', 'country': 'Portugal'}]",https://www.scopus.com/inward/record.uri?partnerID=HzOxMe3b&scp=85175083893&origin=inward,Failed to fetch page (status 429)
Damage Identification for Railway Tracks Using Onboard Monitoring Systems in In-Service Vehicles and Data Science,Traquinho N.,Machines,2023-10-01,SCOPUS_ID:85175070926,3,True,2-s2.0-85175070926,Journal,"[{'name': 'Universidade do Porto', 'city': 'Porto', 'country': 'Portugal'}]",https://www.scopus.com/inward/record.uri?partnerID=HzOxMe3b&scp=85175070926&origin=inward,Failed to fetch page (status 429)
Assessing the Impact of Data Sciences and Smart Technologies in Air Conditioning Project Management: A Delphi Method Analysis within the Construction Industry,Ali B.M.,Buildings,2023-10-01,SCOPUS_ID:85175033862,1,True,2-s2.0-85175033862,Journal,"[{'name': 'Alnoor University', 'city': 'Nineveh', 'country': 'Iraq'}, {'name': 'Kastamonu University', 'city': 'Kastamonu', 'country': 'Turkey'}]",https://www.scopus.com/inward/record.uri?partnerID=HzOxMe3b&scp=85175033862&origin=inward,Failed to fetch page (status 429)
Data Flourishing: Developing Human-Centered Data Science through Communities of Ethical Practice,Poole A.H.,Proceedings of the Association for Information Science and Technology,2023-10-01,SCOPUS_ID:85174578895,3,False,2-s2.0-85174578895,Journal,"[{'name': 'Drexel University', 'city': 'Philadelphia', 'country': 'United States'}]",https://www.scopus.com/inward/record.uri?partnerID=HzOxMe3b&scp=85174578895&origin=inward,Failed to fetch page (status 429)
Detection of Musical Borrowing Using Data Science,Walczak S.,Proceedings of the Association for Information Science and Technology,2023-10-01,SCOPUS_ID:85174533160,1,False,2-s2.0-85174533160,Journal,"[{'name': 'University of South Florida', 'city': 'Wesley Chapel', 'country': 'United States'}]",https://www.scopus.com/inward/record.uri?partnerID=HzOxMe3b&scp=85174533160&origin=inward,Failed to fetch page (status 429)
MagNet—A Data-Science Competition to Predict Disturbance Storm-Time Index (Dst) From Solar Wind Data,Nair M.,Space Weather,2023-10-01,SCOPUS_ID:85173760692,3,True,2-s2.0-85173760692,Journal,"[{'name': 'University of Colorado Boulder', 'city': 'Boulder', 'country': 'United States'}, {'name': 'National Centers for Environmental Information', 'city': 'Boulder', 'country': 'United States'}]",https://www.scopus.com/inward/record.uri?partnerID=HzOxMe3b&scp=85173760692&origin=inward,Failed to fetch page (status 429)
Theoretical and practical data science and analytics: challenges and solutions,Leung C.K.,International Journal of Data Science and Analytics,2023-10-01,SCOPUS_ID:85173758568,1,True,2-s2.0-85173758568,Journal,"[{'name': 'University of Manitoba', 'city': 'Winnipeg', 'country': 'Canada'}]",https://www.scopus.com/inward/record.uri?partnerID=HzOxMe3b&scp=85173758568&origin=inward,Failed to fetch page (status 429)
"Precision Oncology Comes of Age: Designing Best-in-Class Small Molecules by Integrating Two Decades of Advances in Chemistry, Target Biology, and Data Science",Stuart D.D.,Cancer Discovery,2023-10-01,SCOPUS_ID:85173566298,4,True,2-s2.0-85173566298,Journal,"[{'name': 'Scorpion Therapeutics', 'city': 'Boston', 'country': 'United States'}]",https://www.scopus.com/inward/record.uri?partnerID=HzOxMe3b&scp=85173566298&origin=inward,Failed to fetch page (status 429)
The Stanford Medicine data science ecosystem for clinical and translational research,Callahan A.,JAMIA Open,2023-10-01,SCOPUS_ID:85168776030,10,True,2-s2.0-85168776030,Journal,"[{'name': 'Stanford University School of Medicine', 'city': 'Stanford', 'country': 'United States'}]",https://www.scopus.com/inward/record.uri?partnerID=HzOxMe3b&scp=85168776030&origin=inward,Failed to fetch page (status 429)
JAX-FEM: A differentiable GPU-accelerated 3D finite element solver for automatic inverse design and mechanistic data science,Xue T.,Computer Physics Communications,2023-10-01,SCOPUS_ID:85163337429,19,True,2-s2.0-85163337429,Journal,"[{'name': 'Robert R. McCormick School of Engineering and Applied Science', 'city': 'Evanston', 'country': 'United States'}]",https://www.scopus.com/inward/record.uri?partnerID=HzOxMe3b&scp=85163337429&origin=inward,Failed to fetch page (status 429)
Harnessing data science to improve molecular structure elucidation from tandem mass spectrometry,Harris E.,Structural Chemistry,2023-10-01,SCOPUS_ID:85161525328,0,True,2-s2.0-85161525328,Journal,"[{'name': 'Swiss Data Science Center', 'city': 'Lausanne', 'country': 'Switzerland'}]",https://www.scopus.com/inward/record.uri?partnerID=HzOxMe3b&scp=85161525328&origin=inward,Failed to fetch page (status 429)
Urban street network and data science based spatial connectivity evaluation of African cities: implications for sustainable urban development,Mengistie B.M.,GeoJournal,2023-10-01,SCOPUS_ID:85159479643,0,False,2-s2.0-85159479643,Journal,"[{'name': 'Kotebe University of Education', 'city': 'Addis Ababa', 'country': 'Ethiopia'}, {'name': 'The Hong Kong Polytechnic University', 'city': 'Hong Kong', 'country': 'Hong Kong'}]",https://www.scopus.com/inward/record.uri?partnerID=HzOxMe3b&scp=85159479643&origin=inward,Failed to fetch page (status 429)
Leveraging Data Science and Novel Technologies to Develop and Implement Precision Medicine Strategies in Critical Care,Sanchez-Pinto L.N.,Critical Care Clinics,2023-10-01,SCOPUS_ID:85153204032,6,False,2-s2.0-85153204032,Journal,"[{'name': 'Northwestern University Feinberg School of Medicine', 'city': 'Chicago', 'country': 'United States'}]",https://www.scopus.com/inward/record.uri?partnerID=HzOxMe3b&scp=85153204032&origin=inward,Failed to fetch page (status 429)
The Role of Data Science in Closing the Implementation Gap,King A.J.,Critical Care Clinics,2023-10-01,SCOPUS_ID:85152704933,4,False,2-s2.0-85152704933,Journal,"[{'name': 'University of Pittsburgh School of Medicine', 'city': 'Pittsburgh', 'country': 'United States'}]",https://www.scopus.com/inward/record.uri?partnerID=HzOxMe3b&scp=85152704933&origin=inward,Failed to fetch page (status 429)
Primary students’ learning about citizenship through data science,Makar K.,ZDM - Mathematics Education,2023-10-01,SCOPUS_ID:85145422280,5,True,2-s2.0-85145422280,Journal,"[{'name': 'The University of Queensland', 'city': 'Brisbane', 'country': 'Australia'}]",https://www.scopus.com/inward/record.uri?partnerID=HzOxMe3b&scp=85145422280&origin=inward,Failed to fetch page (status 429)
DATA SCIENCE AND PUBLIC POLICY: A METHODOLOGICAL PROPOSAL FOR QUALIFYING POLICIES FOR LOCAL/ REGIONAL DEVELOPMENT,da Silva Oliveira V.,Revista Brasileira de Gestao e Desenvolvimento Regional,2023-09-30,SCOPUS_ID:85179971560,0,True,2-s2.0-85179971560,Journal,"[{'name': 'Federal University of the South and Southeast of Pará', 'city': 'Xinguara', 'country': 'Brazil'}]",https://www.scopus.com/inward/record.uri?partnerID=HzOxMe3b&scp=85179971560&origin=inward,Failed to fetch page (status 429)
A Flexible School and College Level Qualification in Data Science,Farrell K.,ACM International Conference Proceeding Series,2023-09-27,SCOPUS_ID:85176007764,0,False,2-s2.0-85176007764,Conference Proceeding,"[{'name': 'The University of Edinburgh', 'city': 'Edinburgh', 'country': 'United Kingdom'}]",https://www.scopus.com/inward/record.uri?partnerID=HzOxMe3b&scp=85176007764&origin=inward,Failed to fetch page (status 429)
Data Science-Enabled Palladium-Catalyzed Enantioselective Aryl-Carbonylation of Sulfonimidamides,van Dijk L.,Journal of the American Chemical Society,2023-09-27,SCOPUS_ID:85171576174,17,False,2-s2.0-85171576174,Journal,"[{'name': 'University of Utah, College Of Science', 'city': 'Salt Lake City', 'country': 'United States'}]",https://www.scopus.com/inward/record.uri?partnerID=HzOxMe3b&scp=85171576174&origin=inward,Failed to fetch page (status 429)
Unveiling the Hidden Influence of Defects via Experiment and Data Science,Sambur J.,Chemistry of Materials,2023-09-26,SCOPUS_ID:85175805850,3,True,2-s2.0-85175805850,Journal,"[{'name': 'Colorado State University', 'city': 'Fort Collins', 'country': 'United States'}]",https://www.scopus.com/inward/record.uri?partnerID=HzOxMe3b&scp=85175805850&origin=inward,Failed to fetch page (status 429)
Healthcare through data science - A transdisciplinary perspective from Latin America,Chatterjee P.,IEEE Technology and Engineering Management Society Body of Knowledge (TEMSBOK),2023-09-25,SCOPUS_ID:85174432105,0,False,2-s2.0-85174432105,Book,"[{'name': 'Universidad de la Republica', 'city': 'Montevideo', 'country': 'Uruguay'}]",https://www.scopus.com/inward/record.uri?partnerID=HzOxMe3b&scp=85174432105&origin=inward,Failed to fetch page (status 429)
Handbook of Research on Data Science and Cybersecurity Innovations in Industry 4.0 Technologies,Murugan T.,Handbook of Research on Data Science and Cybersecurity Innovations in Industry 4.0 Technologies,2023-09-21,SCOPUS_ID:85174431550,1,False,2-s2.0-85174431550,Book,"[{'name': 'United Arab Emirates University', 'city': 'Al Ain', 'country': 'United Arab Emirates'}]",https://www.scopus.com/inward/record.uri?partnerID=HzOxMe3b&scp=85174431550&origin=inward,Failed to fetch page (status 429)
Innovative applications of data science: NLP in travel and tourism industries,Marimuthu P.,Handbook of Research on Data Science and Cybersecurity Innovations in Industry 4.0 Technologies,2023-09-21,SCOPUS_ID:85174431136,0,False,2-s2.0-85174431136,Book,"[{'name': 'CMR Institute of Technology', 'city': 'Hydrerabad', 'country': 'India'}]",https://www.scopus.com/inward/record.uri?partnerID=HzOxMe3b&scp=85174431136&origin=inward,Failed to fetch page (status 429)
Smart education system initiatives to support data science and industry 4.0,Saranya V.,Handbook of Research on Data Science and Cybersecurity Innovations in Industry 4.0 Technologies,2023-09-21,SCOPUS_ID:85174430101,0,False,2-s2.0-85174430101,Book,"[{'name': 'Hindusthan College of Engineering &amp; Technology', 'city': 'Coimbatore', 'country': 'India'}]",https://www.scopus.com/inward/record.uri?partnerID=HzOxMe3b&scp=85174430101&origin=inward,Failed to fetch page (status 429)
Application of artificial intelligence and data science across domains: A perspective study,Kavitha R.K.,Handbook of Research on Data Science and Cybersecurity Innovations in Industry 4.0 Technologies,2023-09-21,SCOPUS_ID:85174429971,1,False,2-s2.0-85174429971,Book,"[{'name': 'Kumaraguru College of Technology', 'city': 'Coimbatore', 'country': 'India'}]",https://www.scopus.com/inward/record.uri?partnerID=HzOxMe3b&scp=85174429971&origin=inward,Failed to fetch page (status 429)
Minimum viable governance for data science initiatives,Mathur S.,Research Handbook on the Governance of Projects,2023-09-15,SCOPUS_ID:85175127483,0,False,2-s2.0-85175127483,Book,"[{'name': 'University of Technology Sydney', 'city': 'Sydney', 'country': 'Australia'}]",https://www.scopus.com/inward/record.uri?partnerID=HzOxMe3b&scp=85175127483&origin=inward,Failed to fetch page (status 429)
Integrated and data Science-informed seabed characterisation for optimised foundation design,O'Neill M.P.,Ocean Engineering,2023-09-15,SCOPUS_ID:85164264996,1,True,2-s2.0-85164264996,Journal,"[{'name': 'The University of Western Australia', 'city': 'Perth', 'country': 'Australia'}]",https://www.scopus.com/inward/record.uri?partnerID=HzOxMe3b&scp=85164264996&origin=inward,Failed to fetch page (status 429)
A key review on graph data science: The power of graphs in scientific studies,Das R.,Chemometrics and Intelligent Laboratory Systems,2023-09-15,SCOPUS_ID:85163886689,11,False,2-s2.0-85163886689,Journal,"[{'name': 'Firat Üniversitesi', 'city': 'Elazig', 'country': 'Turkey'}]",https://www.scopus.com/inward/record.uri?partnerID=HzOxMe3b&scp=85163886689&origin=inward,Failed to fetch page (status 429)
Esports analysis with data science,Nagdeote S.,AIP Conference Proceedings,2023-09-13,SCOPUS_ID:85176763646,0,False,2-s2.0-85176763646,Conference Proceeding,"[{'name': 'Fr. Conceicao Rodrigures College of Engineering', 'city': 'Mumbai', 'country': 'India'}]",https://www.scopus.com/inward/record.uri?partnerID=HzOxMe3b&scp=85176763646&origin=inward,Failed to fetch page (status 429)
"Interdisciplinary application of machine learning, data science, and python for cricket analytics",Imdad H.,Advanced Interdisciplinary Applications of Machine Learning Python Libraries for Data Science,2023-09-13,SCOPUS_ID:85174349259,0,False,2-s2.0-85174349259,Book,"[{'name': 'National Textile University Faisalabad', 'city': 'Faisalabad', 'country': 'Pakistan'}]",https://www.scopus.com/inward/record.uri?partnerID=HzOxMe3b&scp=85174349259&origin=inward,Failed to fetch page (status 429)
Advanced interdisciplinary applications of machine learning python libraries for data science,Biju S.M.,Advanced Interdisciplinary Applications of Machine Learning Python Libraries for Data Science,2023-09-13,SCOPUS_ID:85174346792,0,False,2-s2.0-85174346792,Book,"[{'name': 'University of Wollongong in Dubai', 'city': 'Dubai', 'country': 'United Arab Emirates'}]",https://www.scopus.com/inward/record.uri?partnerID=HzOxMe3b&scp=85174346792&origin=inward,Failed to fetch page (status 429)
An exploration of python libraries in machine learning models for data science,Sundaram J.,Advanced Interdisciplinary Applications of Machine Learning Python Libraries for Data Science,2023-09-13,SCOPUS_ID:85174344088,1,False,2-s2.0-85174344088,Book,"[{'name': 'Christ University', 'city': 'Bengaluru', 'country': 'India'}]",https://www.scopus.com/inward/record.uri?partnerID=HzOxMe3b&scp=85174344088&origin=inward,Failed to fetch page (status 429)
The use of data science by healthcare leaders,Salehnejad R.,Research Handbook on Leadership in Healthcare,2023-09-12,SCOPUS_ID:85176346526,1,False,2-s2.0-85176346526,Book,"[{'name': 'Alliance Manchester Business School', 'city': 'Manchester', 'country': 'United Kingdom'}]",https://www.scopus.com/inward/record.uri?partnerID=HzOxMe3b&scp=85176346526&origin=inward,Failed to fetch page (status 429)
German Medical Data Sciences 2023 Preface for the 7th Volume,Röhrig R.,Studies in Health Technology and Informatics,2023-09-12,SCOPUS_ID:85175568584,0,False,2-s2.0-85175568584,Book Series,[],https://www.scopus.com/inward/record.uri?partnerID=HzOxMe3b&scp=85175568584&origin=inward,Failed to fetch page (status 429)
"German Medical Data Sciences: Science, Close to People - Proceedings of the 68th Annual Meeting of the German",,Studies in Health Technology and Informatics,2023-09-12,SCOPUS_ID:85175549608,0,False,2-s2.0-85175549608,Book Series,[],https://www.scopus.com/inward/record.uri?partnerID=HzOxMe3b&scp=85175549608&origin=inward,Failed to fetch page (status 429)
Python-powered stock market analysis leveraging data science techniques for informed investment decisions,Zejnullahi A.,The Software Principles of Design for Data Modeling,2023-09-12,SCOPUS_ID:85174325537,0,False,2-s2.0-85174325537,Book,"[{'name': 'Rochester Institute of Technology', 'city': 'Rochester', 'country': 'United States'}]",https://www.scopus.com/inward/record.uri?partnerID=HzOxMe3b&scp=85174325537&origin=inward,Failed to fetch page (status 429)
A Modern Twist on an Old Measurement: Using Laboratory Automation and Data Science to Determine the Solubility Product of Lead Iodide,Norquist A.J.,Journal of Chemical Education,2023-09-12,SCOPUS_ID:85169156217,1,False,2-s2.0-85169156217,Journal,"[{'name': 'Haverford College', 'city': 'Haverford', 'country': 'United States'}]",https://www.scopus.com/inward/record.uri?partnerID=HzOxMe3b&scp=85169156217&origin=inward,Failed to fetch page (status 429)
