title,author,publicationName,cover_date,scopus_id,cited_by_count,open_access,eid,aggregationType,affiliations,link,abstract
Bridging Theory and Practice: Building an Inclusive Undergraduate Data-Science Program,Ergezer M.,"ASEE Annual Conference and Exposition, Conference Proceedings",2024-06-23,SCOPUS_ID:85202066784,0,False,2-s2.0-85202066784,Conference Proceeding,"[{'name': 'Wentworth Institute of Technology', 'city': 'Boston', 'country': 'United States'}]",https://www.scopus.com/inward/record.uri?partnerID=HzOxMe3b&scp=85202066784&origin=inward,Failed to fetch page (status 429)
Board 326: K-12 Teachers and Data Science: Learning Interdiscplinary Science Through Research Experiences,Herbert-Berger K.G.,"ASEE Annual Conference and Exposition, Conference Proceedings",2024-06-23,SCOPUS_ID:85202045606,0,False,2-s2.0-85202045606,Conference Proceeding,"[{'name': 'Montclair State University', 'city': 'Montclair', 'country': 'United States'}]",https://www.scopus.com/inward/record.uri?partnerID=HzOxMe3b&scp=85202045606&origin=inward,Failed to fetch page (status 429)
Integrating Data Science into the Pipeline Building Toward a Diversified Workforce in Nuclear Energy and Security,Zhao X.,"ASEE Annual Conference and Exposition, Conference Proceedings",2024-06-23,SCOPUS_ID:85202044942,0,False,2-s2.0-85202044942,Conference Proceeding,"[{'name': 'Alabama A and M University', 'city': 'Huntsville', 'country': 'United States'}]",https://www.scopus.com/inward/record.uri?partnerID=HzOxMe3b&scp=85202044942&origin=inward,Failed to fetch page (status 429)
Data-Science Perceptions: A Textual Analysis of Reddit Posts from Non-Computing Engineers,Leger N.,"ASEE Annual Conference and Exposition, Conference Proceedings",2024-06-23,SCOPUS_ID:85202035112,0,False,2-s2.0-85202035112,Conference Proceeding,"[{'name': 'Florida International University', 'city': 'Miami', 'country': 'United States'}]",https://www.scopus.com/inward/record.uri?partnerID=HzOxMe3b&scp=85202035112&origin=inward,Failed to fetch page (status 429)
Developing an Instrument for Assessing Self-Efficacy Confidence in Data Science,Malallah S.,"ASEE Annual Conference and Exposition, Conference Proceedings",2024-06-23,SCOPUS_ID:85202023018,0,False,2-s2.0-85202023018,Conference Proceeding,"[{'name': 'Kansas State University', 'city': 'Manhattan', 'country': 'United States'}]",https://www.scopus.com/inward/record.uri?partnerID=HzOxMe3b&scp=85202023018&origin=inward,Failed to fetch page (status 429)
MOOC Cubes and Clouds - Cloud Native Open Data Sciences for Earth Observation,Zellner P.J.,"International Archives of the Photogrammetry, Remote Sensing and Spatial Information Sciences - ISPRS Archives",2024-06-20,SCOPUS_ID:85197367299,0,True,2-s2.0-85197367299,Conference Proceeding,"[{'name': 'Eurac Research', 'city': 'Bolzano', 'country': 'Italy'}]",https://www.scopus.com/inward/record.uri?partnerID=HzOxMe3b&scp=85197367299&origin=inward,Failed to fetch page (status 429)
DevOps for data science,Gold A.K.,DevOps for Data Science,2024-06-19,SCOPUS_ID:85199736830,0,False,2-s2.0-85199736830,Book,[],https://www.scopus.com/inward/record.uri?partnerID=HzOxMe3b&scp=85199736830&origin=inward,Failed to fetch page (status 429)
Using Data Science Tools to Reveal and Understand Subtle Relationships of Inhibitor Structure in Frontal Ring-Opening Metathesis Polymerization,McFadden T.P.,Journal of the American Chemical Society,2024-06-19,SCOPUS_ID:85195318456,0,False,2-s2.0-85195318456,Journal,"[{'name': 'University of Utah, College Of Science', 'city': 'Salt Lake City', 'country': 'United States'}]",https://www.scopus.com/inward/record.uri?partnerID=HzOxMe3b&scp=85195318456&origin=inward,Failed to fetch page (status 429)
Leveraging data science and machine learning for urban climate adaptation in two major African cities: a HE<sup>2</sup>AT Center study protocol,Jack C.,BMJ Open,2024-06-18,SCOPUS_ID:85196602022,0,True,2-s2.0-85196602022,Journal,"[{'name': 'University of Cape Town', 'city': 'Cape Town', 'country': 'South Africa'}]",https://www.scopus.com/inward/record.uri?partnerID=HzOxMe3b&scp=85196602022&origin=inward,Failed to fetch page (status 429)
Interest-Driven Data Science Curriculum for High School Students: Empirical Evidence from a Pilot Study,Israel-Fishelson R.,"Proceedings of ACM Interaction Design and Children Conference: Inclusive Happiness, IDC 2024",2024-06-17,SCOPUS_ID:85197945943,0,False,2-s2.0-85197945943,Conference Proceeding,"[{'name': 'University of Maryland, College Park', 'city': 'College Park', 'country': 'United States'}]",https://www.scopus.com/inward/record.uri?partnerID=HzOxMe3b&scp=85197945943&origin=inward,Failed to fetch page (status 429)
Growing a FLOWER: Building a Diagram Unifying Flow and ER Notation for Data Science,Ordonez C.,HILDA 2024 - Workshop on Human-In-the-Loop Data Analytics Co-located with SIGMOD 2024,2024-06-14,SCOPUS_ID:85198224792,0,True,2-s2.0-85198224792,Conference Proceeding,"[{'name': 'University of Houston', 'city': 'Houston', 'country': 'United States'}]",https://www.scopus.com/inward/record.uri?partnerID=HzOxMe3b&scp=85198224792&origin=inward,Failed to fetch page (status 429)
Towards Extending XAI for Full Data Science Pipelines,Geisler N.,HILDA 2024 - Workshop on Human-In-the-Loop Data Analytics Co-located with SIGMOD 2024,2024-06-14,SCOPUS_ID:85198221900,0,True,2-s2.0-85198221900,Conference Proceeding,"[{'name': 'Technische Universität Darmstadt', 'city': 'Darmstadt', 'country': 'Germany'}]",https://www.scopus.com/inward/record.uri?partnerID=HzOxMe3b&scp=85198221900&origin=inward,Failed to fetch page (status 429)
Data science and big data analytics,Rehman F.,"Future Communication Systems Using Artificial Intelligence, Internet of Things and Data Science",2024-06-14,SCOPUS_ID:85192132524,0,False,2-s2.0-85192132524,Book,"[{'name': 'National University of Sciences and Technology', 'city': 'Islamabad', 'country': 'Pakistan'}, {'name': 'University of Mianwali', 'city': 'Mianwali', 'country': 'Pakistan'}]",https://www.scopus.com/inward/record.uri?partnerID=HzOxMe3b&scp=85192132524&origin=inward,Failed to fetch page (status 429)
"Future communication systems using artificial intelligence, internet of things and data science",Ullah I.,"Future Communication Systems Using Artificial Intelligence, Internet of Things and Data Science",2024-06-14,SCOPUS_ID:85192125498,0,False,2-s2.0-85192125498,Book,"[{'name': 'Gachon University', 'city': 'Seongnam', 'country': 'South Korea'}]",https://www.scopus.com/inward/record.uri?partnerID=HzOxMe3b&scp=85192125498&origin=inward,Failed to fetch page (status 429)
Data science meets intelligent internet of things,Ullah I.,"Future Communication Systems Using Artificial Intelligence, Internet of Things and Data Science",2024-06-14,SCOPUS_ID:85192119693,0,False,2-s2.0-85192119693,Book,"[{'name': 'Gachon University', 'city': 'Seongnam', 'country': 'South Korea'}]",https://www.scopus.com/inward/record.uri?partnerID=HzOxMe3b&scp=85192119693&origin=inward,Failed to fetch page (status 429)
Insights and Innovations from the SSMCDAT 2023: Bridging Solid-State Materials Chemistry and Data Science,Sparks T.D.,Chemistry of Materials,2024-06-11,SCOPUS_ID:85196179092,0,True,2-s2.0-85196179092,Journal,"[{'name': 'The University of Utah', 'city': 'Salt Lake City', 'country': 'United States'}]",https://www.scopus.com/inward/record.uri?partnerID=HzOxMe3b&scp=85196179092&origin=inward,Failed to fetch page (status 429)
On Integrating the Data-Science and Machine-Learning Pipelines for Responsible AI,Esmaelizadeh A.,"1st Workshop on Governance, Understanding and Integration of Data for Effective and Responsible AI, GUIDE-AI 2024, Co-located with SIGMOD 2024",2024-06-09,SCOPUS_ID:85197304556,0,False,2-s2.0-85197304556,Conference Proceeding,"[{'name': 'University of Nevada, Las Vegas', 'city': 'Las Vegas', 'country': 'United States'}]",https://www.scopus.com/inward/record.uri?partnerID=HzOxMe3b&scp=85197304556&origin=inward,Failed to fetch page (status 429)
Reproducible data science over data lakes: replayable data pipelines with Bauplan and Nessie,Tagliabue J.,"Proceedings of the 8th Workshop on Data Management for End-to-End Machine Learning, DEEM 2024 - In conjunction with the 2024 ACM SIGMOD/PODS Conference",2024-06-09,SCOPUS_ID:85196648037,0,False,2-s2.0-85196648037,Conference Proceeding,"[{'name': 'NYU Tandon School of Engineering', 'city': 'New York', 'country': 'United States'}]",https://www.scopus.com/inward/record.uri?partnerID=HzOxMe3b&scp=85196648037&origin=inward,Failed to fetch page (status 429)
A review on the role of statistical tools in effective functionality of data science,Goolla R.,AIP Conference Proceedings,2024-06-05,SCOPUS_ID:85196157239,0,False,2-s2.0-85196157239,Conference Proceeding,"[{'name': 'SR University', 'city': 'Warangal', 'country': 'India'}]",https://www.scopus.com/inward/record.uri?partnerID=HzOxMe3b&scp=85196157239&origin=inward,Failed to fetch page (status 429)
Engaging elementary students in data science practices,Adisa I.O.,Information and Learning Science,2024-06-05,SCOPUS_ID:85180708261,0,False,2-s2.0-85180708261,Journal,"[{'name': 'Clemson University', 'city': 'Clemson', 'country': 'United States'}]",https://www.scopus.com/inward/record.uri?partnerID=HzOxMe3b&scp=85180708261&origin=inward,Failed to fetch page (status 429)
Beyond Use-Cases: A Participatory Approach to Envisioning Data Science in Law Enforcement,Kearney C.,"2024 ACM Conference on Fairness, Accountability, and Transparency, FAccT 2024",2024-06-03,SCOPUS_ID:85196656494,0,True,2-s2.0-85196656494,Conference Proceeding,"[{'name': 'Technische Universität München', 'city': 'Munich', 'country': 'Germany'}]",https://www.scopus.com/inward/record.uri?partnerID=HzOxMe3b&scp=85196656494&origin=inward,Failed to fetch page (status 429)
The utility of designing data science education programs from a framework of identity,Ahn J.,Improving Equity in Data Science: Re-Imagining the Teaching and Learning of Data in K-16 Classrooms,2024-06-03,SCOPUS_ID:85193542450,0,False,2-s2.0-85193542450,Book,"[{'name': 'University of California, Irvine', 'city': 'Irvine', 'country': 'United States'}]",https://www.scopus.com/inward/record.uri?partnerID=HzOxMe3b&scp=85193542450&origin=inward,Failed to fetch page (status 429)
Improving equity in data science: Re-imagining the teaching and learning of data in K-16 classrooms,Tofel-Grehl C.,Improving Equity in Data Science: Re-Imagining the Teaching and Learning of Data in K-16 Classrooms,2024-06-03,SCOPUS_ID:85193530998,0,False,2-s2.0-85193530998,Book,"[{'name': 'Utah State University', 'city': 'Logan', 'country': 'United States'}]",https://www.scopus.com/inward/record.uri?partnerID=HzOxMe3b&scp=85193530998&origin=inward,Failed to fetch page (status 429)
Humanistic pre-service data science teacher education across the disciplines,Lee V.R.,Improving Equity in Data Science: Re-Imagining the Teaching and Learning of Data in K-16 Classrooms,2024-06-03,SCOPUS_ID:85193507857,0,False,2-s2.0-85193507857,Book,"[{'name': 'Stanford Graduate School of Education', 'city': 'Stanford', 'country': 'United States'}]",https://www.scopus.com/inward/record.uri?partnerID=HzOxMe3b&scp=85193507857&origin=inward,Failed to fetch page (status 429)
Design of tools and learning environments for equitable computer science + data science education,Grover S.,Improving Equity in Data Science: Re-Imagining the Teaching and Learning of Data in K-16 Classrooms,2024-06-03,SCOPUS_ID:85193505084,1,False,2-s2.0-85193505084,Book,"[{'name': 'Harvard University', 'city': 'Cambridge', 'country': 'United States'}]",https://www.scopus.com/inward/record.uri?partnerID=HzOxMe3b&scp=85193505084&origin=inward,Failed to fetch page (status 429)
The case for community-centered data science,Tofel-Grehl C.,Improving Equity in Data Science: Re-Imagining the Teaching and Learning of Data in K-16 Classrooms,2024-06-03,SCOPUS_ID:85193502206,0,False,2-s2.0-85193502206,Book,"[{'name': 'Utah State University', 'city': 'Logan', 'country': 'United States'}]",https://www.scopus.com/inward/record.uri?partnerID=HzOxMe3b&scp=85193502206&origin=inward,Failed to fetch page (status 429)
Perspectives on research and practice in and around cultural relevance for pre-college data science in computing,Walker J.T.,Improving Equity in Data Science: Re-Imagining the Teaching and Learning of Data in K-16 Classrooms,2024-06-03,SCOPUS_ID:85193498067,1,False,2-s2.0-85193498067,Book,"[{'name': 'The University of Texas at El Paso', 'city': 'El Paso', 'country': 'United States'}]",https://www.scopus.com/inward/record.uri?partnerID=HzOxMe3b&scp=85193498067&origin=inward,Failed to fetch page (status 429)
Shrinking lands and growing perspectives: Affordances of data science literacy during a culturally responsive maker project,Hansen T.,Improving Equity in Data Science: Re-Imagining the Teaching and Learning of Data in K-16 Classrooms,2024-06-03,SCOPUS_ID:85193474409,0,False,2-s2.0-85193474409,Book,"[{'name': 'Utah State University', 'city': 'Logan', 'country': 'United States'}]",https://www.scopus.com/inward/record.uri?partnerID=HzOxMe3b&scp=85193474409&origin=inward,Failed to fetch page (status 429)
Data science through natural language with ChatGPT’s Code Interpreter,Ahn S.,Translational and Clinical Pharmacology,2024-06-01,SCOPUS_ID:85198397150,1,True,2-s2.0-85198397150,Journal,"[{'name': 'Inje University, College of Medicine', 'city': 'Gimhae', 'country': 'South Korea'}]",https://www.scopus.com/inward/record.uri?partnerID=HzOxMe3b&scp=85198397150&origin=inward,Failed to fetch page (status 429)
Health consequences of disasters: Advancing disaster data science,Colf L.A.,PNAS Nexus,2024-06-01,SCOPUS_ID:85197896667,0,True,2-s2.0-85197896667,Journal,"[{'name': 'University of Oklahoma Health Sciences Center', 'city': 'Oklahoma City', 'country': 'United States'}]",https://www.scopus.com/inward/record.uri?partnerID=HzOxMe3b&scp=85197896667&origin=inward,Failed to fetch page (status 429)
"Data-Driven Sustainable Investment Strategies: Integrating ESG, Financial Data Science, and Time Series Analysis for Alpha Generation",Sorathiya A.,International Journal of Financial Studies,2024-06-01,SCOPUS_ID:85197178295,0,True,2-s2.0-85197178295,Journal,"[{'name': 'Dwarkadas Jivanlal Sanghvi College of Engineering', 'city': 'Mumbai', 'country': 'India'}]",https://www.scopus.com/inward/record.uri?partnerID=HzOxMe3b&scp=85197178295&origin=inward,Failed to fetch page (status 429)
Inside Production Data Science: Exploring the Main Tasks of Data Scientists in Production Environments,Schmetz A.,AI (Switzerland),2024-06-01,SCOPUS_ID:85196886778,0,True,2-s2.0-85196886778,Journal,"[{'name': 'Fraunhofer Research Institution for Battery Cell Production FFB', 'city': 'Munster', 'country': 'Germany'}]",https://www.scopus.com/inward/record.uri?partnerID=HzOxMe3b&scp=85196886778&origin=inward,Failed to fetch page (status 429)
Experience Economy Perspective on Recreational Fishing Tourism Travelers’ Reviews: A Data Science Approach,Yfantidou G.,Tourism and Hospitality,2024-06-01,SCOPUS_ID:85196853678,0,True,2-s2.0-85196853678,Journal,"[{'name': 'Democritus University of Thrace', 'city': 'Komotini', 'country': 'Greece'}]",https://www.scopus.com/inward/record.uri?partnerID=HzOxMe3b&scp=85196853678&origin=inward,Failed to fetch page (status 429)
Exploratory data science on supercomputers for quantum mechanical calculations,Dawson W.,Electronic Structure,2024-06-01,SCOPUS_ID:85196078411,0,True,2-s2.0-85196078411,Journal,"[{'name': 'RIKEN Center for Computational Science', 'city': 'Kobe', 'country': 'Japan'}]",https://www.scopus.com/inward/record.uri?partnerID=HzOxMe3b&scp=85196078411&origin=inward,Failed to fetch page (status 429)
Unveiling the Future of Oncology and Precision Medicine through Data Science,Zaravinos A.,International Journal of Molecular Sciences,2024-06-01,SCOPUS_ID:85195846905,0,True,2-s2.0-85195846905,Journal,"[{'name': 'European University Cyprus', 'city': 'Nicosia', 'country': 'Cyprus'}, {'name': 'Basic and Translational Cancer Research Center (BTCRC)', 'city': 'Nicosia', 'country': 'Cyprus'}]",https://www.scopus.com/inward/record.uri?partnerID=HzOxMe3b&scp=85195846905&origin=inward,Failed to fetch page (status 429)
Tell your story: Metrics of success for academic data science collaboration and consulting programs,Blake M.R.,Stat,2024-06-01,SCOPUS_ID:85194571754,0,True,2-s2.0-85194571754,Journal,"[{'name': 'NC State University', 'city': 'Raleigh', 'country': 'United States'}]",https://www.scopus.com/inward/record.uri?partnerID=HzOxMe3b&scp=85194571754&origin=inward,Failed to fetch page (status 429)
The student staffing advantage: Data Science Consulting Service at NC State University Libraries,Marchesoni J.,Stat,2024-06-01,SCOPUS_ID:85194571147,1,True,2-s2.0-85194571147,Journal,"[{'name': 'NC State University', 'city': 'Raleigh', 'country': 'United States'}]",https://www.scopus.com/inward/record.uri?partnerID=HzOxMe3b&scp=85194571147&origin=inward,Failed to fetch page (status 429)
Editorial — Emerging trends in data science and business analytics models and applications,Broere M.,Decision Analytics Journal,2024-06-01,SCOPUS_ID:85194323585,0,True,2-s2.0-85194323585,Journal,"[{'name': 'Fachhochschule Münster - Abteilung Steinfurt', 'city': 'Steinfurt', 'country': 'Germany'}]",https://www.scopus.com/inward/record.uri?partnerID=HzOxMe3b&scp=85194323585&origin=inward,Failed to fetch page (status 429)
Insights into modifiers effects in differential mobility spectrometry: A data science approach for metabolomics and peptidomics,Stepanovic S.,Journal of Mass Spectrometry,2024-06-01,SCOPUS_ID:85193077986,0,True,2-s2.0-85193077986,Journal,"[{'name': 'Institute for Chemistry, Technology and Metallurgy', 'city': 'Belgrade', 'country': 'Serbia'}, {'name': 'Université de Genève', 'city': 'Geneva', 'country': 'Switzerland'}]",https://www.scopus.com/inward/record.uri?partnerID=HzOxMe3b&scp=85193077986&origin=inward,Failed to fetch page (status 429)
Do good: Strategies for leading an inclusive data science or statistics consulting team,Maimone C.,Stat,2024-06-01,SCOPUS_ID:85192995995,0,True,2-s2.0-85192995995,Journal,"[{'name': 'Northwestern University', 'city': 'Evanston', 'country': 'United States'}]",https://www.scopus.com/inward/record.uri?partnerID=HzOxMe3b&scp=85192995995&origin=inward,Failed to fetch page (status 429)
Neuroinformatics approach: Hierarchical cluster analysis of Indonesian provinces based on people's welfare indicators in the realm of data science and network studies,Arisanti R.,International Journal of Data and Network Science,2024-06-01,SCOPUS_ID:85192760303,0,True,2-s2.0-85192760303,Journal,"[{'name': 'Universitas Padjadjaran', 'city': 'Bandung', 'country': 'Indonesia'}]",https://www.scopus.com/inward/record.uri?partnerID=HzOxMe3b&scp=85192760303&origin=inward,Failed to fetch page (status 429)
Embracing data science in catalysis research,Suvarna M.,Nature Catalysis,2024-06-01,SCOPUS_ID:85191044866,7,False,2-s2.0-85191044866,Journal,"[{'name': 'ETH Zürich', 'city': 'Zurich', 'country': 'Switzerland'}]",https://www.scopus.com/inward/record.uri?partnerID=HzOxMe3b&scp=85191044866&origin=inward,Failed to fetch page (status 429)
Reading Texts and Data: Data Philology Instead of Data Science,Bubenhofer N.,Zeitschrift fur Literaturwissenschaft und Linguistik,2024-06-01,SCOPUS_ID:85190805076,0,True,2-s2.0-85190805076,Journal,"[{'name': 'Universität Zürich', 'city': 'Zurich', 'country': 'Switzerland'}]",https://www.scopus.com/inward/record.uri?partnerID=HzOxMe3b&scp=85190805076&origin=inward,Failed to fetch page (status 429)
The data science discovery program: A model for data science consulting in higher education,Brown C.T.,Stat,2024-06-01,SCOPUS_ID:85190711927,0,False,2-s2.0-85190711927,Journal,"[{'name': 'UC Berkeley School of Social Welfare', 'city': 'Berkeley', 'country': 'United States'}]",https://www.scopus.com/inward/record.uri?partnerID=HzOxMe3b&scp=85190711927&origin=inward,Failed to fetch page (status 429)
Data science essentials in business administration: A multidisciplinary perspective,Afsharian M.,Decision Analytics Journal,2024-06-01,SCOPUS_ID:85187975862,1,True,2-s2.0-85187975862,Journal,"[{'name': 'Fachhochschule Münster - Abteilung Steinfurt', 'city': 'Steinfurt', 'country': 'Germany'}]",https://www.scopus.com/inward/record.uri?partnerID=HzOxMe3b&scp=85187975862&origin=inward,Failed to fetch page (status 429)
Yoked learning in molecular data science,Li Z.,Artificial Intelligence in the Life Sciences,2024-06-01,SCOPUS_ID:85179785570,3,True,2-s2.0-85179785570,Journal,"[{'name': 'Pratt School of Engineering', 'city': 'Durham', 'country': 'United States'}]",https://www.scopus.com/inward/record.uri?partnerID=HzOxMe3b&scp=85179785570&origin=inward,Failed to fetch page (status 429)
Data science assisted cohesive finite element modelling of impact behaviour of AP-HTPB crystal binder composite,Harjono H.L.,Strain,2024-06-01,SCOPUS_ID:85172158207,1,True,2-s2.0-85172158207,Journal,"[{'name': 'College of Engineering', 'city': 'West Lafayette', 'country': 'United States'}]",https://www.scopus.com/inward/record.uri?partnerID=HzOxMe3b&scp=85172158207&origin=inward,Failed to fetch page (status 429)
"RETRACTED ARTICLE: A game theory data science-based mechanism for licensed pharmaceutical products concerning their deterioration: a case of a micro, small, and medium enterprise in Iran(Annals of Operations Research, (2024), 337, (S23–S24))",Mostofi A.,Annals of Operations Research,2024-06-01,SCOPUS_ID:85160236591,2,True,2-s2.0-85160236591,Journal,"[{'name': 'Wellington School of Business and Government', 'city': 'Wellington', 'country': 'New Zealand'}]",https://www.scopus.com/inward/record.uri?partnerID=HzOxMe3b&scp=85160236591&origin=inward,Failed to fetch page (status 429)
"The use of sentiment and emotion analysis and data science to assess the language of nutrition-, food- and cooking-related content on social media: A systematic scoping review",Molenaar A.,Nutrition Research Reviews,2024-06-01,SCOPUS_ID:85151812312,3,True,2-s2.0-85151812312,Journal,"[{'name': 'Monash University', 'city': 'Melbourne', 'country': 'Australia'}]",https://www.scopus.com/inward/record.uri?partnerID=HzOxMe3b&scp=85151812312&origin=inward,Failed to fetch page (status 429)
The social process of coping with work-related stressors online: A machine learning and interpretive data science approach,Sajjadiani S.,Personnel Psychology,2024-06-01,SCOPUS_ID:85137382787,4,False,2-s2.0-85137382787,Journal,"[{'name': 'UBC Sauder School of Business', 'city': 'Vancouver', 'country': 'Canada'}]",https://www.scopus.com/inward/record.uri?partnerID=HzOxMe3b&scp=85137382787&origin=inward,Failed to fetch page (status 429)
An E-commerce prediction system for product allocation to bridge the gap between cultural analytics and data science,Singhal S.,Expert Systems,2024-06-01,SCOPUS_ID:85132426179,1,False,2-s2.0-85132426179,Journal,"[{'name': 'Manav Rachna International Institute of Research and Studies', 'city': 'Faridabad', 'country': 'India'}]",https://www.scopus.com/inward/record.uri?partnerID=HzOxMe3b&scp=85132426179&origin=inward,Failed to fetch page (status 429)
"Automated approaches, reaction parameterisation, and data science in organometallic chemistry and catalysis: towards improving synthetic chemistry and accelerating mechanistic understanding",Smith S.C.,Digital Discovery,2024-05-24,SCOPUS_ID:85194157811,0,True,2-s2.0-85194157811,Journal,"[{'name': 'University of York', 'city': 'York', 'country': 'United Kingdom'}]",https://www.scopus.com/inward/record.uri?partnerID=HzOxMe3b&scp=85194157811&origin=inward,Failed to fetch page (status 429)
"Proceedings of the 2024 International Conference on Information Technology, Data Science, and Optimization, I-DO 2024",,ACM International Conference Proceeding Series,2024-05-22,SCOPUS_ID:85198745034,0,False,2-s2.0-85198745034,Conference Proceeding,[],https://www.scopus.com/inward/record.uri?partnerID=HzOxMe3b&scp=85198745034&origin=inward,Failed to fetch page (status 429)
Identifying globally relevant learnings from Africa's challenges and solutions to climate change and air pollution-related health impacts: A data science scoping review protocol,Wright C.Y.,BMJ Open,2024-05-20,SCOPUS_ID:85193787640,0,True,2-s2.0-85193787640,Journal,"[{'name': 'South African Medical Research Council', 'city': 'Tygerberg', 'country': 'South Africa'}]",https://www.scopus.com/inward/record.uri?partnerID=HzOxMe3b&scp=85193787640&origin=inward,Failed to fetch page (status 429)
Understanding Risks of Data Science Failures through Sociotechnical Approach,Lahiri S.,Conference on Human Factors in Computing Systems - Proceedings,2024-05-11,SCOPUS_ID:85194147144,0,True,2-s2.0-85194147144,Conference Proceeding,"[{'name': 'School of Information Studies', 'city': None, 'country': 'United States'}]",https://www.scopus.com/inward/record.uri?partnerID=HzOxMe3b&scp=85194147144&origin=inward,Failed to fetch page (status 429)
Geographic data science: A manifesto,Arribas-Bel D.,A Research Agenda for Spatial Analysis,2024-05-03,SCOPUS_ID:85196937856,0,False,2-s2.0-85196937856,Book,"[{'name': 'University of Liverpool', 'city': 'Liverpool', 'country': 'United Kingdom'}]",https://www.scopus.com/inward/record.uri?partnerID=HzOxMe3b&scp=85196937856&origin=inward,Failed to fetch page (status 429)
"Causal, not casual, spatial data science",Griffith G.,A Research Agenda for Spatial Analysis,2024-05-03,SCOPUS_ID:85196936427,0,False,2-s2.0-85196936427,Book,"[{'name': 'University of Bristol', 'city': 'Bristol', 'country': 'United Kingdom'}]",https://www.scopus.com/inward/record.uri?partnerID=HzOxMe3b&scp=85196936427&origin=inward,Failed to fetch page (status 429)
