title,author,publicationName,cover_date,scopus_id,cited_by_count,open_access,eid,aggregationType,affiliations,link,abstract
Data science's cultural construction: qualitative ideas for quantitative work,Brandt P.,Frontiers in Big Data,2024-01-01,SCOPUS_ID:85202186972,0,True,2-s2.0-85202186972,Journal,"[{'name': 'Centre de Sociologie des Organisations Sciences Po', 'city': 'Paris', 'country': 'France'}]",https://www.scopus.com/inward/record.uri?partnerID=HzOxMe3b&scp=85202186972&origin=inward,Failed to fetch page (status 429)
Applications of Data Science and Machine Learning for Combating COVID-19,Tyagi S.,Communications in Computer and Information Science,2024-01-01,SCOPUS_ID:85202170996,0,False,2-s2.0-85202170996,Book Series,"[{'name': 'Ajay Kumar Garg Engineering College', 'city': 'Ghaziabad', 'country': 'India'}]",https://www.scopus.com/inward/record.uri?partnerID=HzOxMe3b&scp=85202170996&origin=inward,Failed to fetch page (status 429)
A Multi-Method Data Science Pipeline for Analyzing Police Service,Haensch A.,American Statistician,2024-01-01,SCOPUS_ID:85202063712,1,False,2-s2.0-85202063712,Journal,"[{'name': 'Tufts University', 'city': 'Medford', 'country': 'United States'}]",https://www.scopus.com/inward/record.uri?partnerID=HzOxMe3b&scp=85202063712&origin=inward,Failed to fetch page (status 429)
A Categorical Transformer with a Data Science Approach for Recommendation Systems Based on Collaborative Filtering,Hurtado R.,Lecture Notes in Networks and Systems,2024-01-01,SCOPUS_ID:85201974382,0,False,2-s2.0-85201974382,Book Series,"[{'name': 'Universidad Politécnica Salesiana, Cuenca', 'city': 'Cuenca', 'country': 'Ecuador'}]",https://www.scopus.com/inward/record.uri?partnerID=HzOxMe3b&scp=85201974382&origin=inward,Failed to fetch page (status 429)
The political economy of digital government: How Silicon Valley firms drove conversion to data science and artificial intelligence in public management,Margetts H.,Public Money and Management,2024-01-01,SCOPUS_ID:85201958750,0,True,2-s2.0-85201958750,Journal,"[{'name': 'Oxford Social Sciences Division', 'city': 'Oxford', 'country': 'United Kingdom'}]",https://www.scopus.com/inward/record.uri?partnerID=HzOxMe3b&scp=85201958750&origin=inward,Failed to fetch page (status 429)
Data Science for Social Climate Change Modelling: Emerging Technologies Review,Ustyianovych T.,Lecture Notes on Data Engineering and Communications Technologies,2024-01-01,SCOPUS_ID:85201936871,0,False,2-s2.0-85201936871,Book Series,"[{'name': 'Lviv Polytechnic National University', 'city': 'Lviv', 'country': 'Ukraine'}]",https://www.scopus.com/inward/record.uri?partnerID=HzOxMe3b&scp=85201936871&origin=inward,Failed to fetch page (status 429)
"Expensive but Worth It: Live Projects in Statistics, Data Science, and Analytics Courses",Ritter C.,Journal of Statistics and Data Science Education,2024-01-01,SCOPUS_ID:85201816127,0,True,2-s2.0-85201816127,Journal,"[{'name': 'Université Catholique de Louvain', 'city': 'Louvain-la-Neuve', 'country': 'Belgium'}]",https://www.scopus.com/inward/record.uri?partnerID=HzOxMe3b&scp=85201816127&origin=inward,Failed to fetch page (status 429)
Enhancing Education in Multi-Energy Systems with Data Science Notebooks,Ehsan A.,"2024 IEEE 22nd Mediterranean Electrotechnical Conference, MELECON 2024",2024-01-01,SCOPUS_ID:85201733900,0,False,2-s2.0-85201733900,Conference Proceeding,"[{'name': 'The University of Manchester', 'city': 'Manchester', 'country': 'United Kingdom'}]",https://www.scopus.com/inward/record.uri?partnerID=HzOxMe3b&scp=85201733900&origin=inward,Failed to fetch page (status 429)
Democratizing Data Science:Using Language Models for Intuitive Data Insights and Visualizations,Sudha S.V.,"Proceedings - 2024 4th International Conference on Pervasive Computing and Social Networking, ICPCSN 2024",2024-01-01,SCOPUS_ID:85201705762,0,False,2-s2.0-85201705762,Conference Proceeding,"[{'name': 'KPR Institute of Engineering and Technology', 'city': 'Coimbatore', 'country': 'India'}]",https://www.scopus.com/inward/record.uri?partnerID=HzOxMe3b&scp=85201705762&origin=inward,Failed to fetch page (status 429)
"Correction: Social Media Impact on the ‘Cosmos’ Blockchain Ecosystem: State and Prospect (Data Science Journal, 23(1): 8. https://doi.org/10.5334/dsj-2024-008)",Pavlyshyn I.,Data Science Journal,2024-01-01,SCOPUS_ID:85201641338,0,True,2-s2.0-85201641338,Journal,"[{'name': 'Taras Shevchenko National University of Kyiv', 'city': 'Kyiv', 'country': 'Ukraine'}]",https://www.scopus.com/inward/record.uri?partnerID=HzOxMe3b&scp=85201641338&origin=inward,Failed to fetch page (status 429)
A Conceptual Framework for Mobility Data Science,Stocker A.,IEEE Access,2024-01-01,SCOPUS_ID:85201628832,0,True,2-s2.0-85201628832,Journal,"[{'name': 'Virtual Vehicle Research GmbH', 'city': 'Graz', 'country': 'Austria'}]",https://www.scopus.com/inward/record.uri?partnerID=HzOxMe3b&scp=85201628832&origin=inward,Failed to fetch page (status 429)
Beyond Large Language Models: Rediscovering the Role of Classical Statistics in Modern Data Science,Gutierrez I.,IEEE International Conference on Fuzzy Systems,2024-01-01,SCOPUS_ID:85201524883,0,False,2-s2.0-85201524883,Conference Proceeding,"[{'name': 'University of Madrid', 'city': 'Madrid', 'country': 'Spain'}]",https://www.scopus.com/inward/record.uri?partnerID=HzOxMe3b&scp=85201524883&origin=inward,Failed to fetch page (status 429)
"Validity, Reliability, and Significance: Empirical Methods for NLP and Data Science: Second Edition",Riezler S.,Synthesis Lectures on Human Language Technologies,2024-01-01,SCOPUS_ID:85201430128,0,False,2-s2.0-85201430128,Book Series,"[{'name': 'Universität Heidelberg', 'city': 'Heidelberg', 'country': 'Germany'}]",https://www.scopus.com/inward/record.uri?partnerID=HzOxMe3b&scp=85201430128&origin=inward,Failed to fetch page (status 429)
How to Build Progressive Public Services with Data Science and Artificial Intelligence,Margetts H.,Political Quarterly,2024-01-01,SCOPUS_ID:85201319327,0,True,2-s2.0-85201319327,Journal,"[{'name': 'Oxford Social Sciences Division', 'city': 'Oxford', 'country': 'United Kingdom'}]",https://www.scopus.com/inward/record.uri?partnerID=HzOxMe3b&scp=85201319327&origin=inward,Failed to fetch page (status 429)
Data science Analysis Using Deep Learning Techniques in Mining Biological Data,Murala P.,"2024 International Conference on Knowledge Engineering and Communication Systems, ICKECS 2024",2024-01-01,SCOPUS_ID:85201303127,0,False,2-s2.0-85201303127,Conference Proceeding,"[{'name': 'Bharath Institute of Higher Education and Research', 'city': 'Chennai', 'country': 'India'}]",https://www.scopus.com/inward/record.uri?partnerID=HzOxMe3b&scp=85201303127&origin=inward,Failed to fetch page (status 429)
An analysis of Open Data Scoring System towards Data Science for Sustainability in Industry 4.0,Castro H.,Procedia Computer Science,2024-01-01,SCOPUS_ID:85201286375,0,True,2-s2.0-85201286375,Conference Proceeding,"[{'name': 'Institute for Systems and Computer Engineering, Technology and Science', 'city': 'Porto', 'country': 'Portugal'}, {'name': 'Instituto Superior de Engenharia do Porto', 'city': 'Porto', 'country': 'Portugal'}]",https://www.scopus.com/inward/record.uri?partnerID=HzOxMe3b&scp=85201286375&origin=inward,Failed to fetch page (status 429)
Teaching Communication in Context: Rhetorical Moves in Data Science Reports,Hutchison A.,IEEE International Professional Communication Conference,2024-01-01,SCOPUS_ID:85201256777,0,False,2-s2.0-85201256777,Conference Proceeding,"[{'name': 'Cornell University', 'city': 'Ithaca', 'country': 'United States'}]",https://www.scopus.com/inward/record.uri?partnerID=HzOxMe3b&scp=85201256777&origin=inward,Failed to fetch page (status 429)
Preparing Physicians of the Future: Incorporating Data Science into Medical Education,Shah R.M.,Medical Science Educator,2024-01-01,SCOPUS_ID:85201235133,0,False,2-s2.0-85201235133,Journal,"[{'name': 'Yale University', 'city': 'New Haven', 'country': 'United States'}]",https://www.scopus.com/inward/record.uri?partnerID=HzOxMe3b&scp=85201235133&origin=inward,Failed to fetch page (status 429)
Risk Assessment of Data Science Projects: A Literature Review on Risk Identification,Holtkemper M.,Lecture Notes in Networks and Systems,2024-01-01,SCOPUS_ID:85200999981,0,False,2-s2.0-85200999981,Book Series,"[{'name': 'FernUniversität in Hagen', 'city': 'Hagen', 'country': 'Germany'}]",https://www.scopus.com/inward/record.uri?partnerID=HzOxMe3b&scp=85200999981&origin=inward,Failed to fetch page (status 429)
Secure and Efficient Web Services Recommendations using Data Science Techniques,Patel P.A.,"2024 5th International Conference for Emerging Technology, INCET 2024",2024-01-01,SCOPUS_ID:85200985374,0,False,2-s2.0-85200985374,Conference Proceeding,"[{'name': 'Kalinga University', 'city': 'Naya Raipur', 'country': 'India'}]",https://www.scopus.com/inward/record.uri?partnerID=HzOxMe3b&scp=85200985374&origin=inward,Failed to fetch page (status 429)
Exploring the Integration of Data Science Competencies in Modern Automation Frameworks: Insights for Workforce Empowerment,Potanin M.,Lecture Notes in Networks and Systems,2024-01-01,SCOPUS_ID:85200964842,0,False,2-s2.0-85200964842,Book Series,"[{'name': 'FernUniversität in Hagen', 'city': 'Hagen', 'country': 'Germany'}]",https://www.scopus.com/inward/record.uri?partnerID=HzOxMe3b&scp=85200964842&origin=inward,Failed to fetch page (status 429)
"Transforming earth science and engineering: the power of artificial intelligence, data science and machine learning",Sajeev R.,Current Science,2024-01-01,SCOPUS_ID:85200962729,0,False,2-s2.0-85200962729,Journal,"[{'name': 'Geological Survey of India', 'city': 'Kolkata', 'country': 'India'}]",https://www.scopus.com/inward/record.uri?partnerID=HzOxMe3b&scp=85200962729&origin=inward,Failed to fetch page (status 429)
Embedding Inclusivity Design into the Data Science Curriculum,Campbell J.,Lecture Notes in Networks and Systems,2024-01-01,SCOPUS_ID:85200946988,0,False,2-s2.0-85200946988,Book Series,"[{'name': 'Leeds Beckett University', 'city': 'Leeds', 'country': 'United Kingdom'}]",https://www.scopus.com/inward/record.uri?partnerID=HzOxMe3b&scp=85200946988&origin=inward,Failed to fetch page (status 429)
Data Source Selection for Integration in Data Sciences via Complex Hesitant Fuzzy Rough Multi-Attribute Decision-Making Method,Albaity M.,IEEE Access,2024-01-01,SCOPUS_ID:85200823708,0,True,2-s2.0-85200823708,Journal,"[{'name': 'King Abdulaziz University', 'city': 'Jeddah', 'country': 'Saudi Arabia'}]",https://www.scopus.com/inward/record.uri?partnerID=HzOxMe3b&scp=85200823708&origin=inward,Failed to fetch page (status 429)
AI Governance: The Role of Global Regulations in Light of the Ethical Views of Data Science Students,Trautmann L.,CEUR Workshop Proceedings,2024-01-01,SCOPUS_ID:85200760644,0,False,2-s2.0-85200760644,Conference Proceeding,"[{'name': 'Budapesti Corvinus Egyetem', 'city': 'Budapest', 'country': 'Hungary'}]",https://www.scopus.com/inward/record.uri?partnerID=HzOxMe3b&scp=85200760644&origin=inward,Failed to fetch page (status 429)
Enhancing Customer Experience through AI-Powered Personalization: A Data Science Perspective in E-Commerce,Thakur H.K.,"Proceedings of International Conference on Communication, Computer Sciences and Engineering, IC3SE 2024",2024-01-01,SCOPUS_ID:85200667969,0,False,2-s2.0-85200667969,Conference Proceeding,"[{'name': 'Bennett University', 'city': 'Greater Noida', 'country': 'India'}]",https://www.scopus.com/inward/record.uri?partnerID=HzOxMe3b&scp=85200667969&origin=inward,Failed to fetch page (status 429)
Soft Actor-Critic in Lux AI Challenge Season 2: Optimizing Resource Collection and Lichen Growth Strategies with Advanced Data Science and Machine Learning,Yao J.T.,"Proceedings - 3rd International Conference on Advances in Computing, Communication and Applied Informatics, ACCAI 2024",2024-01-01,SCOPUS_ID:85200590126,0,False,2-s2.0-85200590126,Conference Proceeding,"[{'name': 'University of Regina', 'city': 'Regina', 'country': 'Canada'}]",https://www.scopus.com/inward/record.uri?partnerID=HzOxMe3b&scp=85200590126&origin=inward,Failed to fetch page (status 429)
UNITABE: A UNIVERSAL PRETRAINING PROTOCOL FOR TABULAR FOUNDATION MODEL IN DATA SCIENCE,Yang Y.,"12th International Conference on Learning Representations, ICLR 2024",2024-01-01,SCOPUS_ID:85200574178,2,False,2-s2.0-85200574178,Conference Proceeding,"[{'name': 'The University of Hong Kong', 'city': 'Hong Kong', 'country': 'Hong Kong'}]",https://www.scopus.com/inward/record.uri?partnerID=HzOxMe3b&scp=85200574178&origin=inward,Failed to fetch page (status 429)
"KGLiDS: A Platform for Semantic Abstraction, Linking, and Automation of Data Science",Helali M.,Proceedings - International Conference on Data Engineering,2024-01-01,SCOPUS_ID:85200476427,0,False,2-s2.0-85200476427,Conference Proceeding,"[{'name': 'Concordia University', 'city': 'Concordia', 'country': 'Canada'}]",https://www.scopus.com/inward/record.uri?partnerID=HzOxMe3b&scp=85200476427&origin=inward,Failed to fetch page (status 429)
DigiTeachVR: Digitally-Enhanced Teaching Platform for Improving Data Science Skills and Virtual Reality Competences in Cross-Disciplinary Engineering Education,Kohl L.,Lecture Notes in Networks and Systems,2024-01-01,SCOPUS_ID:85200461025,0,False,2-s2.0-85200461025,Book Series,"[{'name': 'Technische Universität Wien', 'city': 'Vienna', 'country': 'Austria'}]",https://www.scopus.com/inward/record.uri?partnerID=HzOxMe3b&scp=85200461025&origin=inward,Failed to fetch page (status 429)
PyTond: Efficient Python Data Science on the Shoulders of Databases,Shahrokhi H.,Proceedings - International Conference on Data Engineering,2024-01-01,SCOPUS_ID:85200459973,0,False,2-s2.0-85200459973,Conference Proceeding,"[{'name': 'The University of Edinburgh', 'city': 'Edinburgh', 'country': 'United Kingdom'}]",https://www.scopus.com/inward/record.uri?partnerID=HzOxMe3b&scp=85200459973&origin=inward,Failed to fetch page (status 429)
Xorbits: Automating Operator Tiling for Distributed Data Science,Lu W.,Proceedings - International Conference on Data Engineering,2024-01-01,SCOPUS_ID:85200438356,0,False,2-s2.0-85200438356,Conference Proceeding,"[{'name': 'Renmin University of China', 'city': 'Beijing', 'country': 'China'}]",https://www.scopus.com/inward/record.uri?partnerID=HzOxMe3b&scp=85200438356&origin=inward,Failed to fetch page (status 429)
Influence of Microservice Design Patterns for Data Science Workflows,Schröer C.,Progress in IS,2024-01-01,SCOPUS_ID:85200437039,0,False,2-s2.0-85200437039,Book Series,"[{'name': 'Universität Oldenburg', 'city': 'Oldenburg', 'country': 'Germany'}]",https://www.scopus.com/inward/record.uri?partnerID=HzOxMe3b&scp=85200437039&origin=inward,Failed to fetch page (status 429)
Editorial: Special issue on modern data science and applications,Kong L.,Statistics and its Interface,2024-01-01,SCOPUS_ID:85200373674,0,False,2-s2.0-85200373674,Journal,"[{'name': 'University of Alberta', 'city': 'Edmonton', 'country': 'Canada'}]",https://www.scopus.com/inward/record.uri?partnerID=HzOxMe3b&scp=85200373674&origin=inward,Failed to fetch page (status 429)
Data Science for Photonics and Biophotonics,,Proceedings of SPIE - The International Society for Optical Engineering,2024-01-01,SCOPUS_ID:85200227513,0,False,2-s2.0-85200227513,Conference Proceeding,[],https://www.scopus.com/inward/record.uri?partnerID=HzOxMe3b&scp=85200227513&origin=inward,Failed to fetch page (status 429)
Applied Data Science and Smart Systems,Singh J.,Applied Data Science and Smart Systems,2024-01-01,SCOPUS_ID:85200199385,0,True,2-s2.0-85200199385,Book,[],https://www.scopus.com/inward/record.uri?partnerID=HzOxMe3b&scp=85200199385&origin=inward,Failed to fetch page (status 429)
Preface: Second International Conference on Applied Data Science and Smart Systems,,Applied Data Science and Smart Systems,2024-01-01,SCOPUS_ID:85200198733,0,False,2-s2.0-85200198733,Book,[],https://www.scopus.com/inward/record.uri?partnerID=HzOxMe3b&scp=85200198733&origin=inward,Failed to fetch page (status 429)
"2nd IEEE International Conference on Data Science and Information System, ICDSIS 2024",,"2nd IEEE International Conference on Data Science and Information System, ICDSIS 2024",2024-01-01,SCOPUS_ID:85200105553,0,False,2-s2.0-85200105553,Conference Proceeding,[],https://www.scopus.com/inward/record.uri?partnerID=HzOxMe3b&scp=85200105553&origin=inward,Failed to fetch page (status 429)
Exploring the Organizational Models for Data Science in Agile Software Development: Challenges and Strategies from a Multi-Case Study,Ulfsnes R.,Proceedings of the Annual Hawaii International Conference on System Sciences,2024-01-01,SCOPUS_ID:85199779367,0,False,2-s2.0-85199779367,Conference Proceeding,"[{'name': 'Norges Teknisk-Naturvitenskapelige Universitet', 'city': 'Trondheim', 'country': 'Norway'}, {'name': 'SINTEF Foundation for Scientific and Industrial Research', 'city': 'Trondheim', 'country': 'Norway'}]",https://www.scopus.com/inward/record.uri?partnerID=HzOxMe3b&scp=85199779367&origin=inward,Failed to fetch page (status 429)
Introduction to Data Science and Machine Learning to Support Business Decisions Mini-track,Delen D.,Proceedings of the Annual Hawaii International Conference on System Sciences,2024-01-01,SCOPUS_ID:85199761826,0,False,2-s2.0-85199761826,Conference Proceeding,"[{'name': 'Oklahoma State University', 'city': 'Main Campus', 'country': 'United States'}]",https://www.scopus.com/inward/record.uri?partnerID=HzOxMe3b&scp=85199761826&origin=inward,Failed to fetch page (status 429)
Introducing Women to Data Science: Investigating the Gender Gap in a Learning Initiative on Kaggle,Twyman M.,Proceedings of the Annual Hawaii International Conference on System Sciences,2024-01-01,SCOPUS_ID:85199753819,0,False,2-s2.0-85199753819,Conference Proceeding,"[{'name': 'University of Southern California', 'city': 'Los Angeles', 'country': 'United States'}]",https://www.scopus.com/inward/record.uri?partnerID=HzOxMe3b&scp=85199753819&origin=inward,Failed to fetch page (status 429)
A modular inquiry-based semester theme that integrates data science education and bioinformatics in protein structure function courses,Amtul Z.,FEMS Microbiology Letters,2024-01-01,SCOPUS_ID:85199711776,1,True,2-s2.0-85199711776,Journal,"[{'name': 'University of Windsor', 'city': 'Windsor', 'country': 'Canada'}]",https://www.scopus.com/inward/record.uri?partnerID=HzOxMe3b&scp=85199711776&origin=inward,Failed to fetch page (status 429)
Student Learning Based Data Science Assisted Recommendation System to Enhance Educational Institution Performance,Jyothi D.N.,International Journal of Intelligent Engineering and Systems,2024-01-01,SCOPUS_ID:85199686067,0,False,2-s2.0-85199686067,Journal,"[{'name': 'Chaitanya Bharathi Institute of Technology', 'city': 'Hyderabad', 'country': 'India'}]",https://www.scopus.com/inward/record.uri?partnerID=HzOxMe3b&scp=85199686067&origin=inward,Failed to fetch page (status 429)
"Data science and analytics, modeling, simulation, and issues of omics dataset",Kumar S.,"Integrative Omics: Concept, Methodology, and Application",2024-01-01,SCOPUS_ID:85199643828,0,False,2-s2.0-85199643828,Book,"[{'name': 'Bioinformatics Centre', 'city': 'Lucknow', 'country': 'India'}]",https://www.scopus.com/inward/record.uri?partnerID=HzOxMe3b&scp=85199643828&origin=inward,Failed to fetch page (status 429)
Enhancing Explainability in Mobility Data Science Through a Combination of Methods,Makridis G.,Lecture Notes in Networks and Systems,2024-01-01,SCOPUS_ID:85199558146,0,False,2-s2.0-85199558146,Book Series,"[{'name': 'University of Piraeus', 'city': 'Piraeus', 'country': 'Greece'}]",https://www.scopus.com/inward/record.uri?partnerID=HzOxMe3b&scp=85199558146&origin=inward,Failed to fetch page (status 429)
Predictive Modeling and Decision-Making in Data Science: A Comparative Study,Valli L.N.,"5th International Conference on Recent Trends in Computer Science and Technology, ICRTCST 2024 - Proceedings",2024-01-01,SCOPUS_ID:85199317090,0,False,2-s2.0-85199317090,Conference Proceeding,"[{'name': 'Standard Chartered Global Business Services Sdn Bhd.', 'city': 'Kuala Lumpur', 'country': 'Malaysia'}]",https://www.scopus.com/inward/record.uri?partnerID=HzOxMe3b&scp=85199317090&origin=inward,Failed to fetch page (status 429)
Data Science: Machine Learning and Multivariate Analysis in Learning Styles,Máiquez D.,Lecture Notes in Networks and Systems,2024-01-01,SCOPUS_ID:85199217712,0,False,2-s2.0-85199217712,Book Series,"[{'name': 'Instituto Tecnológico Universitario ISMAC', 'city': 'Quito', 'country': 'Ecuador'}]",https://www.scopus.com/inward/record.uri?partnerID=HzOxMe3b&scp=85199217712&origin=inward,Failed to fetch page (status 429)
Determination of Hyperparameters in the Development of a Frost Predictive Model with Data Science,Masanet M.I.,Communications in Computer and Information Science,2024-01-01,SCOPUS_ID:85199192209,0,False,2-s2.0-85199192209,Book Series,"[{'name': 'Universidad Nacional de San Juan', 'city': 'San Juan', 'country': 'Argentina'}]",https://www.scopus.com/inward/record.uri?partnerID=HzOxMe3b&scp=85199192209&origin=inward,Failed to fetch page (status 429)
Use of Digital Tools Contributing to the Digital Transition in Engineering and Data Science Courses,Cardoso A.,Lecture Notes in Networks and Systems,2024-01-01,SCOPUS_ID:85199153567,0,False,2-s2.0-85199153567,Book Series,"[{'name': 'University of Coimbra, Centre for Informatics and System', 'city': 'Coimbra', 'country': 'Portugal'}]",https://www.scopus.com/inward/record.uri?partnerID=HzOxMe3b&scp=85199153567&origin=inward,Failed to fetch page (status 429)
Formally Verifying Data Science Systems with a Sound an Correct Formalism,Asteasuain F.,Communications in Computer and Information Science,2024-01-01,SCOPUS_ID:85199149960,0,False,2-s2.0-85199149960,Book Series,"[{'name': 'Universidad Nacional de Avellaneda', 'city': 'Avellaneda', 'country': 'Argentina'}, {'name': 'Universidad Abierta Interamericana', 'city': 'Buenos Aires', 'country': 'Argentina'}]",https://www.scopus.com/inward/record.uri?partnerID=HzOxMe3b&scp=85199149960&origin=inward,Failed to fetch page (status 429)
"2nd Southwest Data Science Conference, SDSC 2023",,Communications in Computer and Information Science,2024-01-01,SCOPUS_ID:85199147315,0,False,2-s2.0-85199147315,Book Series,[],https://www.scopus.com/inward/record.uri?partnerID=HzOxMe3b&scp=85199147315&origin=inward,Failed to fetch page (status 429)
Development of a Modularized Undergraduate Data Science and Big Data Curricular Using No-Code Software Development Tools,Mafukidze H.D.,IEEE Access,2024-01-01,SCOPUS_ID:85199024681,0,True,2-s2.0-85199024681,Journal,"[{'name': 'Midlands State University Zimbabwe', 'city': 'Gweru', 'country': 'Zimbabwe'}]",https://www.scopus.com/inward/record.uri?partnerID=HzOxMe3b&scp=85199024681&origin=inward,Failed to fetch page (status 429)
Preface: modern data science technologies workshop,Emmerich M.,CEUR Workshop Proceedings,2024-01-01,SCOPUS_ID:85198984811,0,False,2-s2.0-85198984811,Conference Proceeding,"[{'name': 'University of Jyväskylä', 'city': 'Jyvaskyla', 'country': 'Finland'}, {'name': 'Universiteit Leiden', 'city': 'Leiden', 'country': 'Netherlands'}]",https://www.scopus.com/inward/record.uri?partnerID=HzOxMe3b&scp=85198984811&origin=inward,Failed to fetch page (status 429)
MoDaST 2024 - Proceedings of the Modern Data Science Technologies Workshop,,CEUR Workshop Proceedings,2024-01-01,SCOPUS_ID:85198937420,0,False,2-s2.0-85198937420,Conference Proceeding,[],https://www.scopus.com/inward/record.uri?partnerID=HzOxMe3b&scp=85198937420&origin=inward,Failed to fetch page (status 429)
Integration of data science with product design towards data-driven design,Liu A.,CIRP Annals,2024-01-01,SCOPUS_ID:85198753145,0,True,2-s2.0-85198753145,Journal,"[{'name': 'UNSW Sydney', 'city': 'Sydney', 'country': 'Australia'}]",https://www.scopus.com/inward/record.uri?partnerID=HzOxMe3b&scp=85198753145&origin=inward,Failed to fetch page (status 429)
Vibration Monitoring of Historical Towers: New Contributions from Data Science,Girardi M.,Lecture Notes in Civil Engineering,2024-01-01,SCOPUS_ID:85198738374,0,False,2-s2.0-85198738374,Book Series,"[{'name': ""Istituto di Scienza e Tecnologie dell'Informazione A. Faedo"", 'city': 'Pisa', 'country': 'Italy'}]",https://www.scopus.com/inward/record.uri?partnerID=HzOxMe3b&scp=85198738374&origin=inward,Failed to fetch page (status 429)
"Proceedings - 2024 7th International Women in Data Science Conference at Prince Sultan University, WiDS-PSU 2024",,"Proceedings - 2024 7th International Women in Data Science Conference at Prince Sultan University, WiDS-PSU 2024",2024-01-01,SCOPUS_ID:85198622223,0,False,2-s2.0-85198622223,Conference Proceeding,[],https://www.scopus.com/inward/record.uri?partnerID=HzOxMe3b&scp=85198622223&origin=inward,Failed to fetch page (status 429)
Fostering the Development of Earth Data Science Skills in a Diverse Community of Online Learners: A Case Study of the Earth Data Science Corps,Quarderer N.A.,Journal of Statistics and Data Science Education,2024-01-01,SCOPUS_ID:85198518626,0,True,2-s2.0-85198518626,Journal,"[{'name': 'Cooperative Institute for Research in Environmental Sciences', 'city': 'Boulder', 'country': 'United States'}, {'name': 'University of Colorado Boulder', 'city': 'Boulder', 'country': 'United States'}, {'name': 'The Environmental Data Science Innovation and Inclusion Lab (ESIIL)', 'city': 'Boulder', 'country': 'United States'}, {'name': 'Earth Observing Laboratory', 'city': 'Boulder', 'country': 'United States'}]",https://www.scopus.com/inward/record.uri?partnerID=HzOxMe3b&scp=85198518626&origin=inward,Failed to fetch page (status 429)
